### ISSUE TITLE
Neighbor Discovery for IPv6

### ISSUE THREAD

**Issue by nashif** [zephyriot/zep-jira14#714]
**_Reported by Gajinder Vij:_**

The Zephyr IP stack shall support Neighbor Discovery for IPv6 as specified in RFC 4861

(Imported from Jira ZEP-807)

**Comment by nashif** [comment]
**_by Andrei Laperie:_**

merged to net branch

**Comment by nashif** [comment]
**_by Andrei Laperie:_**

reopening per process as it was not merged into master, only avail in the net branch

**Comment by nashif** [comment]
**_by Andrei Laperie:_**

marking items of new IP stack

**Comment by nashif** [comment]
**_by Andrei Laperie:_**

These came with new IP stack merging

**Comment by nashif** [comment]
**_by Jing Wang:_**

I checked ND by echo_server qemu, ND is workable but not stable. In my Qemu testing environment, there is 30% possibility that client send NS packet, but no NA response.

steps:
*)  clone net-tools repo
*) follow README, simulate tap device by
Terminal 1:
$ ./loop-socat.sh
Terminal 2:
$ sudo ./loop-slip-tap.sh
*) cd samples/net/echo_server; make qemu
*) $ ping6 -I tap0 -c 1 2001:db8::1

if ping succeed, it show below tcpdump log
```
16:25:46.494053 IP6 2001:db8::2 > ff02::1:ff00:1: ICMP6, neighbor solicitation, who has 2001:db8::1, length 32
16:25:46.501316 IP6 2001:db8::1 > 2001:db8::2: ICMP6, neighbor advertisement, tgt is 2001:db8::1, length 32
```

There is 30% possibility to ping fail, it show below tcpdump log
```
15:29:48.879315 IP6 2001:db8::2 > ff02::1:ff00:1: ICMP6, neighbor solicitation, who has 2001:db8::1, length 32
15:29:49.877585 IP6 2001:db8::2 > ff02::1:ff00:1: ICMP6, neighbor solicitation, who has 2001:db8::1, length 32
```
Obviously, zephyr side doesn't respond NS command from host side.

**Comment by nashif** [comment]
Related to GH-1723
